{
  "schemaVersion": 1,
  "commandId": "11111111-1111-4111-8111-111111111111",
  "idempotencyKey": "fixture:ingest:1",
  "correlationId": "correlation-fixture-1",
  "requestedAt": "2026-07-12T00:02:20.000Z",
  "caller": { "identity": "fixture-test", "laneId": "lane-fixture" },
  "subject": { "type": "keyword", "id": "antique-chair" },
  "artifact": { "schemaVersion": 1, "bucket": "appraisily-auction-db", "path": "antique-chair/" },
  "audit": { "status": "ok", "reference": "antique-chair/page-audit.json" },
  "novelty": { "decision": "promote", "reference": "antique-chair/novelty.json" },
  "options": { "force": false, "concurrency": 1 }
}

